{
  "$schema": "http://json-schema.org/draft-07/schema#",
  "$id": "catalyx/schemas/catalyst_event.json",
  "schema_version": "1.3",
  "title": "CatalystEvent",
  "description": "A discrete, timestamped macro event that may drive sector repricing. Decays in relevance over time.",
  "type": "object",
  "required": ["id", "schema_version", "type", "created_at", "detected_at", "catalyst_type", "description", "novelty_score", "strength_score", "status"],
  "properties": {
    "$schema": { "type": "string", "description": "Optional self-reference to this schema file. Present on all event documents (de-facto convention); declared here so strict additionalProperties:false validation passes." },
    "id": {
      "type": "string",
      "pattern": "^cat_[0-9]{8}_[a-z0-9_]+$",
      "description": "Format: cat_YYYYMMDD_keyword. Human-readable slug."
    },
    "schema_version": { "type": "string", "enum": ["1.2", "1.3"], "description": "1.3 (v11 P2/P3) adds strength_rubric_scores, strength_anchors and halflife_override_reason. 1.2 documents still validate and still score — the new fields are LINTED by catalyx.scorer.catalyst_audit, never required by the scorer, so a pre-1.3 event is reported as a bare cardinal rather than dropped." },
    "type": { "type": "string", "const": "event" },
    "created_at": { "type": "string", "format": "date-time" },
    "detected_at": { "type": "string", "format": "date-time" },
    "event_date": { "type": ["string", "null"], "format": "date-time", "description": "When the event OCCURRED (vs detected_at = when registered). Canonical decay anchor used by catalyst_scorer._anchor_date; present on ~all events." },
    "source": {
      "type": "object",
      "required": ["type"],
      "properties": {
        "type": { "type": "string", "enum": ["news_article", "official_announcement", "official_statement", "data_release", "earnings_report", "cot_report", "etf_flow", "user_manual"] },
        "url": { "type": "string" },
        "publication": { "type": "string" },
        "published_at": { "type": "string", "format": "date-time" }
      }
    },
    "catalyst_type": {
      "type": "string",
      "enum": [
        "monetary_policy",
        "fiscal_policy",
        "geopolitical",
        "commodity_supply",
        "regulatory",
        "institutional_flow",
        "macro_data_release",
        "corporate_event",
        "technology_breakthrough",
        "sanctions_trade"
      ]
    },
    "catalyst_subtype": { "type": "string" },
    "description": { "type": "string", "minLength": 20 },
    "geography": {
      "type": "array",
      "items": { "type": "string" },
      "description": "ISO 3166-1 alpha-3 or region codes (EU, GLOBAL, APAC, EM)"
    },
    "magnitude": {
      "type": "string",
      "enum": ["low", "medium", "high", "extreme"]
    },
    "novelty_score": {
      "type": "number",
      "enum": [0, 20, 40, 60, 80, 100],
      "description": "Rubric-derived. Sum of 5 binary questions × 20 each. See scoring_weights.yaml novelty_score_rubric. Never assign directly — compute from novelty_rubric_scores below."
    },
    "novelty_rubric_scores": {
      "type": "object",
      "description": "Answers to the 5 novelty rubric questions (yes=true, no=false). novelty_score = count(true) × 20.",
      "properties": {
        "nov_01_different_type": { "type": "boolean" },
        "nov_02_new_sector": { "type": "boolean" },
        "nov_03_new_source": { "type": "boolean" },
        "nov_04_changes_rate": { "type": "boolean" },
        "nov_05_consensus_surprise_gt50": { "type": "boolean" }
      }
    },
    "strength_score": {
      "type": "number",
      "minimum": 0,
      "maximum": 100,
      "description": "How hard the event hits. Main sort key. Derive it from strength_rubric_scores below and bracket it with strength_anchors — the bare number is not reproducible across sessions (schema 1.3, v11 P2). Continuous, unlike novelty_score. The SCORER re-spaces it by rank within the registered-event population before use; see scoring_weights.yaml event_strength_calibration."
    },
    "strength_rubric_scores": {
      "type": "object",
      "description": "Answers to the 5 strength rubric questions (yes=true, no=false). Weighted total should land within strength_anchoring.max_rubric_divergence of strength_score. See scoring_weights.yaml strength_score_rubric. Unanswered counts as false — these are OBSERVABLE questions, so 'not checked' and 'no' are the same evidentiary state.",
      "properties": {
        "str_01_magnitude_large": { "type": "boolean" },
        "str_02_decided_not_proposed": { "type": "boolean" },
        "str_03_consensus_surprise": { "type": "boolean" },
        "str_04_corroborated": { "type": "boolean" },
        "str_05_changes_a_rate": { "type": "boolean" }
      }
    },
    "strength_anchors": {
      "type": "object",
      "description": "CLAUDE.md rule 3 made mechanical: name one REGISTERED event this one is stronger than and one it is weaker than. strength_score must fall inside that bracket (catalyx.scorer.catalyst_audit enforces it). The bracket is what persists across sessions; the absolute number never did.",
      "properties": {
        "stronger_than": { "type": "string", "description": "Registered event id whose strength is a LOWER bound for this one." },
        "weaker_than": { "type": "string", "description": "Registered event id whose strength is an UPPER bound for this one." },
        "note": { "type": "string" }
      }
    },
    "halflife_override_reason": {
      "type": "string",
      "minLength": 20,
      "description": "Required to set decay_halflife_days to anything other than this catalyst_type's value in catalyst_taxonomy.yaml (schema 1.3, v11 P3). The type table is the default and the author picks the TYPE, not the number; an override is allowed but must say why, because six pre-1.3 events silently overrode it — five toward longer persistence, which is the direction that keeps a spent event scoring."
    },
    "consensus_surprise": {
      "type": "number",
      "enum": [0.0, 0.1, 0.2, 0.3, 0.4, 0.5, 0.6, 0.7, 0.8, 0.9, 1.0],
      "description": "0=fully expected, 1=complete surprise. Use 0.1 increments only — avoids false precision."
    },
    "is_priced_in_estimate": {
      "type": "number",
      "enum": [0.0, 0.25, 0.50, 0.75, 1.0],
      "description": "Stepped estimate of how much is already in price. Use one of 5 levels only. See scoring_weights.yaml is_priced_in_levels for anchored criteria. Never use intermediate values."
    },
    "relation_to_structural": {
      "type": ["string", "null"],
      "enum": ["confirms", "contradicts", "independent", null],
      "description": "Relationship of this event to its linked structural catalyst. Determines scoring interaction: confirms → amplification, contradicts → dampening, independent → additive. Required when related_catalyst_ids contains a struct_ ID. See scoring_weights.yaml catalyst_interaction_factors."
    },
    "decay_halflife_days": {
      "type": "number",
      "default": 46,
      "description": "Days for relevance to decay to 50%. Default 46 (lambda=0.015). Adjust for policy catalysts (longer) vs data releases (shorter)."
    },
    "related_catalyst_ids": {
      "type": "array",
      "items": { "type": "string" },
      "description": "IDs of related catalysts (struct_ or cat_). If a struct_ ID is included, relation_to_structural must be set."
    },
    "raw_signal_ids": {
      "type": "array",
      "items": { "type": "string" }
    },
    "status": {
      "type": "string",
      "enum": ["active", "decayed", "invalidated", "archived"]
    },
    "expires_at": { "type": ["string", "null"], "format": "date", "description": "Optional expiry date; null = no fixed expiry (decays instead). Nullable to match all existing event documents." },
    "user_rank": {
      "type": ["integer", "null"],
      "minimum": 1,
      "description": "User-assigned priority. 1=highest. null=unranked (treated as rank 3, multiplier 1.0)."
    },
    "user_notes": { "type": "string" },
    "tags": {
      "type": "array",
      "items": { "type": "string" }
    }
  },
  "additionalProperties": false
}
